dlga_lord_talk_ask_something_2:lord_courtship_permission|{s10} avoir l'honneur de rendre visite à {s14}{s12} ?
dlga_lord_courtship_permission:lord_pretalk|{s12}
dlga_lord_courtship_permission:lord_pretalk.1|D'après ce que j'ai entendu, vous lui avez déjà parlé sans ma permission. Alors maintenant écoutez, je suis son seigneur et son gardien, et j'ai des projets pour elle. Je ne tolérerai pas que l'on me raille derrière mon dos pour n'être pas capable de contrôler les femmes de ma maison. Je vous demande donc de ne plus aborder ce sujet avec moi à l'avenir.
dlga_lord_courtship_permission:lord_pretalk.2|{s14}
dlga_lord_talk_ask_something_2:lord_talk_ask_marriage_1|Quelles seraient les conditions pour une alliance durable avec votre maison ?
dlga_lord_talk_ask_something_2:lord_pretalk|Laissez tomber.
dlga_lord_talk_ask_location:lord_talk_ask_location_2|Très bien, il se peut que j'aie des réponses pour vous, ou pas. De qui voulez-vous des nouvelles ?
dlga_lord_talk_ask_location_2:lord_talk_ask_location_3|{s1}
dlga_lord_talk_ask_location_2:lord_talk_ask_location|{s1}
dlga_lord_talk_ask_location_3:lady_pretalk|{s1}
dlga_lord_talk_ask_location_3:lord_pretalk|{s1}
dlga_lord_talk_ask_about_war:lord_talk_ask_about_war_2|{s12}
dlga_lord_talk_ask_about_war_2:lord_talk_ask_about_war_details|Dites-m'en plus au sujet de la guerre avec le {s1}.
dlga_lord_talk_ask_about_war_2:lord_pretalk|C'est tout ce que je voulais savoir, merci.
dlga_lord_talk_ask_about_war_details:lord_talk_ask_about_war_2|{s9}.
dlga_lord_talk_ask_about_strategy:lord_strategy_follow_evaluation|{s7} {s9} {s14}
dlga_lord_strategy_follow_evaluation:lord_talk_ask_something_2|Avez-vous d'autres questions ?
dlga_lord_strategy_follow_evaluation:lord_strategy_follow_up|Notre chef, {s4}, est bien trop {reg4?indécise. Elle:indécis. Il} pourrait tout aussi bien utiliser l'armée pour attaquer l'ennemi... ou le laisser rentrer chez lui.
dlga_lord_strategy_follow_evaluation:lord_strategy_follow_up.1|Notre armée est là, à ne rien faire. Visiblement, trop peu de vassaux ont répondu à l'appel aux armes. {s4} n'apprécie peut-être pas la confiance des grands seigneurs de ce royaume.
dlga_lord_strategy_follow_evaluation:lord_strategy_follow_up.2|Je ne suis pas d'accord avec cette stratégie. Je préférerais {s4}.
dlga_lord_strategy_follow_evaluation:lord_strategy_follow_up.3|Je préférerais attaquer {s8}, mais notre maréchal, le {s10}, pense que {s9}
dlga_lord_strategy_follow_evaluation:lord_strategy_follow_up.4|Je préférerais défendre {s8}, plutôt que {s9}.
dlga_lord_strategy_follow_evaluation:lord_talk|Autre chose ?
dlga_lord_strategy_follow_evaluation:lord_strategy_follow_up.5|Cette stratégie me semble raisonnable.
dlga_lord_strategy_follow_up:lord_strategy_why_not|Si vous attaquez, pourquoi ne pas...
dlga_lord_strategy_follow_up:lord_talk_ask_something_again|Je vois...
dlga_lord_strategy_follow_up:lord_talk_replace_marshal|Voudriez-vous donc dire que {s4} ne devrait plus être maréchal ?
dlga_lord_talk_replace_marshal:lord_talk_ask_something_again|Je pense que notre royaume devrait résoudre cette question concernant {s4} avant que nous envisagions le remplacement du maréchal.
dlga_lord_talk_replace_marshal:lord_talk_ask_something_again.1|Oui, j'ai déjà clairement exprimé ma position à ce propos. Je pense que le maréchal devrait être {s4}, plutôt que le {s5}.
dlga_lord_talk_replace_marshal:lord_talk_ask_something_again.2|J'entends prendre ma propre décision sur ce point, {monsieur, madame}.
dlga_lord_talk_replace_marshal:lord_talk_replace_marshal_decision|Hum...
dlga_lord_talk_replace_marshal_decision:lord_talk_ask_something_again|Oui, voilà ce que je pense. À ce stade, je serais tenté de dire que je soutiens plutôt le {s15}. Je suis ravi d'avoir eu cette discussion avec vous et de savoir que nous partageons le même point de vue.
dlga_lord_talk_replace_marshal_decision:lord_talk_ask_something_again.1|Pas forcément. Je peux très bien avoir un désaccord avec {s4} sur la stratégie à suivre sans pour autant chercher à l'évincer.
dlga_lord_strategy_why_not:lord_strategy_why_not_select|Oui ?
dlga_lord_strategy_why_not_select:lord_talk_ask_something_again|Oubliez ça.
dlga_lord_strategy_why_not_select:lord_strategy_why_not_reason|...envisager de continuer d'attaquer {s4} ?
dlga_lord_strategy_why_not_select:lord_strategy_why_not_reason.1|...défendre {s4} ?
dlga_lord_strategy_why_not_select:lord_strategy_why_not_reason.2|...attaquer {s4} ?
dlga_lord_strategy_why_not_reason:lord_talk_why_not_repeat|{s9}
dlga_lord_strategy_why_not_reason:lord_talk_why_not_repeat.1|Notre maréchal, {s11}, pense que {s8} {s9}{s10}
dlga_lord_strategy_why_not_reason:lord_talk_why_not_repeat.2|Nous pourrions nous y rendre. {s7} Mais, {s5} {s3} {s4}. {s6} {s8}.
dlga_lord_talk_why_not_repeat:lord_strategy_why_not_select|Auriez-vous d'autres questions de ce genre ? Pourquoi ne pas...
dlga_lord_talk_ask_marriage_1:lord_pretalk|Ne le prenez pas mal mais, en tant que roi, j'ai d'autres projets pour mes enfants.
dlga_lord_talk_ask_marriage_1:lord_pretalk.1|Nous avons coutume de sceller de telles alliances par le mariage. Malheureusement, personne dans ma famille n'est à marier.
dlga_lord_talk_ask_marriage_1:lord_courtship_pre_permission|{s15}
dlga_lord_talk_ask_marriage_1:lord_marriage_proposal_female_pc_confirm|Êtes-vous en train de me proposer de vous épouser ?
dlga_lord_courtship_pre_permission:lord_courtship_permission|Puis-je {s15}suggérer de me considérer comme votre gendre ?
dlga_lord_courtship_pre_permission:lord_marriage_permission_engagement_date|TRICHE - Fiançailles
dlga_lord_courtship_pre_permission:lord_pretalk|Peu importe.
dlga_lord_marriage_proposal_female_pc_confirm:lord_marriage_proposal_female_pc_reax|Oui, tout à fait.
dlga_lord_marriage_proposal_female_pc_confirm:lord_pretalk|Non, je crains que vous n'ayez mal interprété mes propos
dlga_lord_marriage_proposal_female_pc_reax:lord_pretalk|{s14}
dlga_lord_marriage_proposal_female_pc_reax:lord_marriage_proposal_female_pc_next_step|{s14}
dlga_lord_marriage_proposal_female_pc_next_step:lord_marriage_proposal_female_pc_next_step_4|Je suppose que maintenant la prochaine étape consiste pour moi à adresser un message à votre famille pour lui demander votre main, mais je pense que c'est vous qui décidez.
dlga_lord_marriage_proposal_female_pc_next_step_4:lord_marriage_proposal_female_pc_next_step_5|C'est exact.
dlga_lord_marriage_proposal_female_pc_next_step_5:lord_marriage_proposal_female_pc_confirm_engagement|Bon, très bien. Puisque rien ne fait obstacle à notre mariage, pouvons-nous nous considérer comme fiancés ? Je vais organiser un grand banquet et nous échangerons nos vœux devant tous les seigneurs du royaume. Du moins, si vous êtes d'accord...
dlga_lord_marriage_proposal_female_pc_confirm_engagement:lord_marriage_proposal_female_pc_confirm_engagement_yes|Je suis d'accord.
dlga_lord_marriage_proposal_female_pc_confirm_engagement:lord_marriage_proposal_female_pc_confirm_engagement_no|En fait, j'aimerais y réfléchir.
dlga_lord_marriage_proposal_female_pc_confirm_engagement_yes:close_window|Excellent. Si tout va bien, dans un mois nous serons mariés. {s12}
dlga_lord_marriage_proposal_female_pc_confirm_engagement_no:close_window|Prenez le temps qu'il vous faudra, madame.
dlga_lord_talk:party_encounter_lord_hostile_ultimatum_surrender|Je ne le répéterai pas, {s4} ! Rendez-vous ou vous mourrez !
dlga_party_encounter_lord_hostile_ultimatum_surrender:close_window|{s43}
dlga_lord_talk:lord_predemand|Je suis ici pour vous faire part de mes intentions !
dlga_lord_predemand:lord_demand|Ah ? Que voulez-vous ?
dlga_lord_demand:lord_ultimatum_surrender|Je vous offre une dernière chance de vous rendre, sinon vous mourrez.
dlga_lord_ultimatum_surrender:lord_attack_verify|{s43}
dlga_lord_attack_verify:lord_attack_verify_cancel|Pardonnez-moi messire, je ne sais pas ce qui m'a pris.
dlga_lord_attack_verify_cancel:close_window|Alors dégagez.
dlga_lord_attack_verify:lord_attack_verify_commit|Ce ne sont pas vos affaires. Préparez-vous à vous battre !
dlga_lord_ultimatum_surrender:lord_attack_verify_b|{s43}
dlga_lord_attack_verify_b:lord_attack_verify_cancel|Pardonnez-moi messire, je ne sais pas ce qui m'a pris.
dlga_lord_attack_verify_b:lord_attack_verify_commit|Nous verrons cela. Préparez-vous à vous battre !
dlga_lord_attack_verify_commit:close_window|{s43}
dlga_lord_demand:lord_pretalk|Pardonnez-moi, ce n'est pas grave.
dlga_lord_talk:liege_defends_claim_1|J'ai rencontré au cours de mes voyage quelqu'un qui se fait appeler {s45}...
dlga_liege_defends_claim_1:liege_defends_claim_2|Oh vraiment ? Peu de gens osent mentionner ce nom en ma présence. Je ne sais pas exactement si je dois vous récompenser de votre bravoure ou si je dois vous punir pour votre impudence.
dlga_liege_defends_claim_2:liege_defends_claim_3|Très bien, je vais satisfaire votre curiosité. Mais écoutez-moi attentivement, car j'aimerais bien ne plus avoir à aborder ce sujet.
dlga_liege_defends_claim_3:liege_defends_claim_4|{s48}
dlga_liege_defends_claim_4:lord_talk|{s48}
dlga_lord_join_rebellion_suggest_cheat:close_window|Cheat:d'accord.
dlga_lord_talk:lord_prison_break_chains|Je suis là pour vous faire sortir d'ici.
dlga_lord_prison_break_chains:close_window|Dieu merci, vous voilà ! Mais je n'irai nulle pas avec ces chaînes aux pieds. Vous allez devoir en dérober la clé au garde.
dlga_lord_tell_objective:lord_pretalk|Ce que je suis en train de faire ? Ça ne se voit pas pas ? Je suis prisonnier ici !
dlga_lord_tell_objective:lord_pretalk.1|Je n'ai aucun homme sous mes ordres pour l'instant.
dlga_lord_tell_objective:lord_pretalk.2|Nous nous reposons actuellement à {s1}. {s14}{s15}
dlga_lord_tell_objective:lord_pretalk.3|Nous faisons actuellement route vers {s1}. {s14}{s15}
dlga_lord_tell_objective_2:lord_pretalk|Je me dirige vers les alentours de {s1}. {s14}{s15}
dlga_lord_tell_objective:lord_pretalk.4|Nous recrutons actuellement des soldats provenant de {s1}. {s14}{s15}
dlga_lord_tell_objective:lord_pretalk.5|Nous recherchons actuellement l'ennemi autour de {s1}. {s14}{s15}
dlga_lord_tell_objective:lord_pretalk.6|Nous dévastons actuellement le village de {s1}. {s14}{s15}
dlga_lord_tell_objective:lord_pretalk.7|Nous nous replions actuellement sur {s1}. {s14}{s15}
dlga_lord_tell_objective:lord_pretalk.8|Nous assiégeons actuellement {s1}. {s14}{s15}
dlga_lord_tell_objective:lord_pretalk.9|Nous nous battons actuellement contre {s1}. {s14}{s15}
dlga_lord_tell_objective:lord_pretalk.10|Je surveille actuellement l'avance de {s1}. {s14}{s15}
dlga_lord_tell_objective:lord_pretalk.11|Nous accompagnons actuellement {s1}. {s14}{s15}
dlga_lord_tell_objective:lord_talk_ask_about_strategy|Je mène actuellement l'armée du royaume.
dlga_lord_tell_objective:lord_pretalk.12|Nous réfléchissons à ce que nous allons faire.
dlga_lord_tell_objective:lord_pretalk.13|Je ne sais pas : {reg1} {s1} (ERREUR)
dlga_lord_talk:lord_ask_follow|Me suivrez-vous ? J'ai un plan.
dlga_lord_ask_follow:close_window|J'apprécie votre compagnie, {playername}, mais d'importantes affaires réclament mon attention. Peut-être pourrons-nous voyager de concert un autre jour...
dlga_lord_ask_follow:close_window.1|Ce serait peu convenable, {playername}. Mais pourquoi ne me suivez-vous pas vous-même ?
dlga_lord_ask_follow:close_window.2|{s43}
dlga_lord_ask_follow:close_window.3|Prenez la tête, {playername} ! Semons la mort et triomphons de tous nos ennemis.
dlga_lord_talk_preoffer:lord_talk_offer|Oui ?
dlga_lord_talk_offer:knight_offer_join|Je souhaite racheter l'un de vos prisonniers.
dlga_lord_talk_offer:lord_pretalk|Peu importe.
dlga_knight_offer_join:hero_pretalk|Je crains de ne pouvoir me joindre à vous pour l'instant, {playername}. J'ai une affaire importante à régler et cela ne peut attendre.
dlga_knight_offer_join:hero_pretalk.1|N'oubliez pas à qui vous vous adressez, {messire/madame}. Je ne reçois pas d'ordres de gens comme vous.
dlga_knight_offer_join:knight_offer_join_2|Je serais heureux de me battre à vos cotés, mon ami, mais il y a un problème... Le fait est que, je me suis un peu endetté et je dois tout rembourser au plus vite. {reg6} cerfs d'argent en tout, et il en va de mon honneur de rembourser chaque pièce. À moins que vous n'ayez {reg6} cerfs d'argent à me céder, je me dois de concentrer mes efforts à m'ôter ce poids des épaules.
dlga_knight_offer_join:close_window|Me joindre à vous ? Je ne pense pas.
dlga_knight_offer_join:knight_offer_join_2.1|Oui, mon ami. Je serai ravi de me joindre à vous.
dlga_knight_offer_join_2:knight_offer_join_accept|Tenez, prenez ça, les {reg6} cerfs d'argent dont vous avez besoin. Ce n'est que de l'argent.
dlga_knight_offer_join_2:knight_offer_join_accept.1|Alors voyageons ensemble, mon ami.
dlga_knight_offer_join_2:close_window|C'est bon à savoir. J'y penserai.
dlga_knight_offer_join_2:hero_pretalk|C'est bon à savoir. J'y penserai.
dlga_knight_offer_join_accept:knight_offer_join_accept_party|J'ai quelques hommes de confiance dans mon groupe qui pourraient vous être utiles. Que souhaitez-vous en faire ?
dlga_knight_offer_join_accept:close_window|Ah, certainement, cela pourrait être amusant !
dlga_knight_offer_join_accept_party:knight_join_party_disband|Vous pouvez dissoudre votre troupe. Je n'en ai pas besoin de soldats supplémentaires.
dlga_knight_offer_join_accept_party:knight_join_party_join|Vos hommes peuvent également se joindre à nous. Nous avons besoin de chaque homme disponible.
dlga_knight_offer_join_accept_party:knight_join_party_lead_out|Menez vos hommes hors de la ville. Je vous rattraperai sur la route.
dlga_knight_offer_join_accept_party:knight_join_party_lead_out.1|Continuer de vaquer à vos occupations. Je vous rejoindrai plus tard.
dlga_knight_join_party_disband:close_window|Ah très bien, {playername}. Bien que je n'aime pas perdre des hommes de valeur, c'est votre choix. Je vais dissoudre mes troupes et me joindre à vous.
dlga_knight_join_party_join:close_window|Excellent. Mes hommes et moi voyagerons avec vous.
dlga_knight_join_party_lead_out:close_window|Très bien, dans ce cas je vais continuer de patrouiller dans les environs. Revenez si vous avez de nouveaux ordres pour moi.
dlga_lord_enter_service_reject:close_window|Bien entendu... N'avez-vous donc offert votre vassalité que pour gagner du temps ? Très bien, je vais vous laisser le temps de reconsidérer la question, mais sachez que si vous jouez avec moi, votre réputation en pâtira.
dlga_lord_give_oath_give_up:close_window|Bien entendu... N'avez-vous donc offert votre vassalité que pour gagner du temps ? Très bien, je vais vous laisser le temps de reconsidérer la question, mais sachez que si vous jouez avec moi, votre réputation en pâtira.
dlga_lord_enter_service_reject:close_window.1|Quel gâchis ! Et dire que j'allais vous offrir une place parmi mes nobles ! Partez, misérable, avant que je ne sorte de mes gonds !
dlga_lord_ask_enter_service:lord_give_oath_under_oath_already|N'avez-vous pas déjà juré allégeance au {s5} ?
dlga_lord_give_oath_under_oath_already:lord_pretalk|En effet, je le suis, {s65}. Pardonnez ma confusion.
dlga_lord_ask_enter_service:lord_pretalk|Seuls ceux en qui je peux avoir confiance peuvent me prêter serment, {playername}.
dlga_lord_ask_enter_service:lord_ask_enter_service_female_2|Madame, vous semblez avoir l'étoffe d'un excellent chef de guerre. Pour une femme, un tel talent n'est pas courant à Calradia, mais pas sans précédent non plus. De nobles femmes ont souvent pris le commandement des armées de leurs époux ou de leurs pères après que ceux-ci soient morts ou aient été faits prisonniers, par exemple.
dlga_lord_ask_enter_service_female_2:lord_ask_enter_service_female_response|Cependant, je n'ai jamais entendu parler d'un roi qui aurait accordé un fief à une femme, quel qu'en soit le courage, juste parce qu'il lui fallait un autre vassal. Si je devais le faire, je sais que ce serait mal vu à Calradia. Les hommes me croiraient ensorcelé ou bien décidé à changer l'ordre naturel des choses. Je regrette, mais je ne peux pas vous accorder de fief.
dlga_lord_ask_enter_service_female_response:lord_ask_enter_service_female_solution_capture|Et si je venais à prendre de force un des châteaux de votre ennemi ?
dlga_lord_ask_enter_service_female_response:lord_ask_enter_service_female_solution_marriage|Et si je venais à épouser un de vos seigneurs ?
dlga_lord_ask_enter_service_female_response:lord_ask_enter_service_female_solution_competitor|Un de vos concurrents fera peut-être preuve de plus d'ouverture d'esprit.
dlga_lord_ask_enter_service_female_response:lord_ask_enter_service|Même sans fief, je ne rechignerais pas à combattre pour vous.
dlga_lord_ask_enter_service_female_response:lord_pretalk|Tant pis.
dlga_lord_ask_enter_service_female_solution_marriage:lord_ask_enter_service_female_response|Eh bien, je ne vous accorderais pas pour autant de fief. Cela étant, vous pourriez jouir des propriétés de votre époux, ce qui vous permettrait d'agir comme l'un de mes vassaux, sans en avoir le titre. Vous avez d'autres questions ?
dlga_lord_ask_enter_service_female_solution_competitor:lord_ask_enter_service_female_response|Oh, peut-être trouverez-vous quelqu'un de vraiment désespéré, mais alors je ne crois pas qu'il aurait beaucoup de fiefs à accorder. Vous avez d'autres questions ?
dlga_lord_ask_enter_service_female_solution_capture:lord_ask_enter_service_female_response|Eh bien, dans ce cas, selon les circonstances, je pourrais vous permettre de le conserver. Vous avez d'autres questions ?
dlga_lord_ask_enter_service:lord_give_oath_1|On me parle volontiers de vous en {homme d'armes valeureux/guerrière courageuse} et comme un bon meneur de troupes, {playername}. Je serais heureux d'avoir votre épée à mon service et de vous accorder votre vassalité, si vous êtes prêt à me rendre hommage.
dlga_lord_ask_enter_service:lord_pretalk.1|Vous devez encore me montrer que vous êtes un commandant compétent, {playername}. Tournez votre épée contre l'ennemi et prouvez-moi que vous êtes digne de devenir mon vassal. Alors nous pourrons en reparler.
dlga_lord_give_oath_1:lord_give_oath_2|Je suis prêt, {s65}.
dlga_lord_give_oath_1:lord_give_oath_give_up|Pardonnez-moi, {s65}, je dois y réfléchir davantage...
dlga_lord_give_oath_give_up:lord_pretalk|Prenez tout le temps qu'il vous faudra, madame.
dlga_lord_give_oath_give_up:close_window.1|À quoi jouez-vous, {playername} ? Décidez-vous, et arrêtez de me faire perdre mon temps.
dlga_lord_give_oath_2:lord_give_oath_3|Bien, répétez donc les mots de votre serment avec moi : je vous prête serment d'hommage en tant que régent légitime du {s41}.
dlga_lord_give_oath_3:lord_give_oath_4|Je vous prête serment d'hommage en tant que régent légitime du {s41}.
dlga_lord_give_oath_3:lord_give_oath_give_up|Excusez-moi {reg65?madame:messire}, mais je pense que je dois y réfléchir.
dlga_lord_give_oath_4:lord_give_oath_5|Je vous resterai {fidèle et dévoué/fidèle et dévouée} jusqu'à mon dernier souffle...
dlga_lord_give_oath_5:lord_give_oath_6|Je vous resterai {fidèle et dévoué/fidèle et dévouée} jusqu'à mon dernier souffle...
dlga_lord_give_oath_5:lord_give_oath_give_up|{reg65?Madame:Messire}, puis-je vous demander un peu de temps pour y réfléchir ?
dlga_lord_give_oath_6:lord_give_oath_7|... et je serai à votre côté pour combattre vos ennemis si vous deviez avoir besoin de mon épée.
dlga_lord_give_oath_7:lord_give_oath_8|... et je serai à votre côté pour combattre vos ennemis si vous deviez avoir besoin de mon épée.
dlga_lord_give_oath_7:lord_give_oath_give_up|{reg65?Madame:Mon seigneur}, veuillez me donner davantage de temps pour réfléchir.
dlga_lord_give_oath_8:lord_give_oath_9|Et enfin, je ferai respecter vos revendications légales et celles de vos héritiers légitimes.
dlga_lord_give_oath_9:lord_give_oath_10|Et enfin, je ferai respecter vos revendications légales et celles de vos héritiers légitimes.
dlga_lord_give_oath_9:lord_give_oath_give_up|{reg65?Madame:Messire}, il me faut plus de temps pour y réfléchir.
dlga_lord_give_oath_10:lord_give_oath_go_on_2|Très bien, Vous m'avez prêté votre serment solennel, {playername}. Puissiez-vous toujours l'honorer, avec la bravoure et la dévotion qui lui sont dûes.
dlga_lord_give_oath_go_on_2:lord_give_oath_go_on_3|À dater de ce jour, vous serez connu de tous comme mon vassal et me serez lié par serment. Je vous offre ma protection et vous accorde le droit de prendre les armes en mon nom et je jure de ne point vous ôter la vie, ni de vous priver de votre liberté ou de vos biens hormis par le jugement légitime de vos pairs ou par la loi et les us et coutumes en vigueur dans la région. {reg1? De plus, je vous donne le fief de {s1} avec toutes ses taxes et ses revenus.:}
dlga_lord_give_oath_go_on_3:lord_give_conclude|Vous avez pris une sage décision, {playername}. Servez-moi comme il se doit et je vous promets que vous irez loin.
dlga_lord_give_conclude:lord_give_conclude_2|{s41}
dlga_lord_give_conclude_2:close_window.1|Qu'il en soit ainsi, chère épouse. Puissent tous mes vassaux montrer autant de courage que vous.
dlga_lord_give_conclude_2:close_window.2|Je nourris de grands espoirs pour vous, {playername}. Je sais que vous vous montrerez digne de la confiance que je place en vous.
dlga_lord_ask_enter_service:lord_enter_service_swear|Hé hé, un geste d'une grande sagesse, {playername}. En me servant loyalement, {un homme/une femme} sous mes ordres peut devenir riche et puissant, et nos ennemis... Et bien, nos ennemis seront fauchés comme le blé par une faux. Cependant, pour être l'un de mes sujets, vous devez d'abord renoncer à tous les serments prêtés et à tous les engagements par lesquels vous êtes liés, et jurer de ne servir que le {s5}.
dlga_lord_enter_service_swear:lord_enter_service_swear_accepted|Je le jure, {s65}.
dlga_lord_enter_service_swear:lord_enter_service_swear_denied|J'ai besoin d'un peu de temps pour y réfléchir.
dlga_lord_enter_service_swear_denied:close_window|Vous me faites marcher ? Je n'ai pas le temps de jouer, {playername}. Décidez-vous et arrêtez de me faire perdre mon temps.
dlga_lord_enter_service_swear_accepted:lord_enter_service_swear_accepted_2|Alors, je suis heureux de vous accueillir pour servir ma demeure. À dater de ce jour, {playername}, vous êtes un soldat du {s5} avec toutes les obligations et les privilèges qui lui incombent.
dlga_lord_enter_service_swear_accepted_2:close_window|Je vous charge de traquer et de détruire les forces ennemis aux endroits où vous pourrez les trouver. De plus, j'aurai des tâches spéciales à vous confier de temps en temps, comme le font certains de mes autres vassaux. Soyez sous mes ordres, combattez et honorez vos serments. Ceci vous mènera loin, si vous avez dans l'idée de gravir les échelons. Puisse Dieu nous accorder une longue vie et nous permette de célébrer de nombreuses victoires dans ma demeure !
dlga_lord_ask_leave_service:lord_ask_leave_service_verify|Hum, votre serment est-il devenu pesant, {playername} ? Il est inhabituel de demander à renoncer à son serment d'hommage, mais en raison de vos bons services, je ne vous retiendrai pas si vous souhaitez réellement y mettre un terme. Même si vous nous manquerez cruellement.
dlga_lord_ask_leave_service:lord_ask_leave_service_verify.1|Renoncer à votre serment ? Hum, peut-être cela serait-il préférable pour tout le monde... Cependant, {playername}, il faut que vous soyez sûr que c'est vraiment ce que vous désirez, ce genre de décision ne peut se prendre à la légère.
dlga_lord_ask_leave_service:lord_ask_leave_service_verify.2|Sortie de l'hommage? Hmm, peut-être pour le mieux ... Cependant, {playername}, vous devez être sûr que la version est ce que vous désirez. Ce n'est pas une chose faite à la légère.
dlga_lord_ask_leave_service_verify:lord_ask_leave_service_2|Je dois le faire, {s65}.
dlga_lord_ask_leave_service_verify:lord_ask_leave_service_giveup|Vous avez raison, {s65}, ma place est à vos côtés.
dlga_lord_ask_leave_service_giveup:lord_pretalk|Je suis heureux de l'entendre, {playername}. J'espère qu'à l'avenir, vous chasserez ce genre de pensées de votre esprit.
dlga_lord_ask_leave_service_2:lord_ask_leave_service_verify_again|Vous en êtes certain ? Soyez conscient que si vous quittez mes services, vous allez devoir me restituer tous les fiefs que vous possédez en mon nom.
dlga_lord_ask_leave_service_2:lord_ask_leave_service_verify_again.1|Alors vous êtes sûr? Aussi, sachez que si vous quittez mes services, vous me rendez tous les fiefs que vous détenez à mon nom.
dlga_lord_ask_leave_service_verify_again:lord_ask_leave_service_3|Oui, je suis sur (s65).
dlga_lord_ask_leave_service_verify_again:lord_ask_leave_service_giveup Bien sûr que non, {s65}. Je suis un frère maintenant.
dlga_lord_ask_leave_service_verify_again:lord_ask_leave_service_giveup.1|Bien sûr que non, {s65}. Je suis toujours votre vassal loyal.
dlga_lord_ask_leave_service_3:lord_ask_leave_service_end|Puisque vous le souhaitez, par la présente, je déclare votre serment caduque. Vous ne détiendrez plus aucun domaine ou titre en mon nom et vous êtes {libéré/libérée} de vos obligations envers mon royaume. Vous êtes libre, {playername}.
dlga_lord_ask_leave_service_3:lord_ask_leave_service_end.1|Comme vous le souhaitez. Je déclare que vos serments sont nulles et non avenus. Vous ne détenez plus de terre ou de titres à mon nom, et vous êtes libéré de vos fonctions dans ma maison. Vous êtes libre, {playername}.
