dlga_minstrel_courtship_poem_teach_3:minstrel_courtship_poem_teach_4|Très bien - répétez-moi:^ Un ours, il y avait un ours, un ours, tout noir et brun et recouvert de cheveux. Oh, viens-tu, dit-il, viens-t-il à la foire? Dit-il mais je suis un ours ...
dlga_minstrel_courtship_poem_teach_3:minstrel_courtship_poem_teach_4.1|Très bien - répète après moi:^ J'adore une femme de chambre aussi juste que l'été, ^ avec la lumière du soleil dans ses cheveux.^ J'adore une femme de chambre rouge comme l'automne, avec le coucher dans ses cheveux.^ J'adore une femme de chambre aussi blanche que l'hiver, avec un moonglow dans ses cheveux.
dlga_minstrel_courtship_poem_teach_3:minstrel_courtship_poem_teach_4.2|Très bien - répétez-moi:^ La femme de Dornishman était aussi juste que le soleil, et ses bisous étaient plus chauds que le printemps. Mais la lame de Dornishman était en acier noir, et son bisou était un Chose terrible.La femme de Dornishman chantait comme elle se baignait, dans une voix douce comme une pêche, mais la lame de Dornishman avait une chanson propre, et une morsure forte et froide comme une sangsue.
dlga_minstrel_courtship_poem_teach_3:minstrel_courtship_poem_teach_4.3|Très bien - répétez-moi:^ Et là, il était debout avec l'épée en main, le dernier des dix de Darry.^ Et rouge l'herbe sous ses pieds, et rouge ses banderoles brillantes, et rouge la lueur du soleil couchant, qui l'a baigné dans sa lumière.^ 'Allez, allez, dit le grand seigneur, mon épée a encore faim.^ Et avec un cri de rage sauvage, ^ Ils ont essoufflé sur la railloute.
dlga_minstrel_courtship_poem_teach_3:minstrel_courtship_poem_teach_4.4|Très bien - répétez-moi:^ Le seigneur, il est venu à cheval sur un jour de pluie, hey-nonny, hey-nonny, hey-nonny-hey ..^ La dame a assis une couture sur un jour pluvieux, hey-nonny, hey-nonny, hey-nonny-hey ..
dlga_minstrel_courtship_poem_teach_4:minstrel_learn_poem_continue|'Un ours, il y avait un ours, un ours ...'
dlga_minstrel_courtship_poem_teach_4:minstrel_learn_poem_continue.1|'J'ai adoré une femme de chambre aussi juste que l'été ...'
dlga_minstrel_courtship_poem_teach_4:minstrel_learn_poem_continue.2|La femme de Dornishman était aussi juste que le soleil ...'
dlga_minstrel_courtship_poem_teach_4:minstrel_learn_poem_continue.3|'Et là, il était debout avec l'épée en main ...'
dlga_minstrel_courtship_poem_teach_4:minstrel_learn_poem_continue.4|Le seigneur, il est venu en train de monter sur un jour pluvieux ...'
dlga_minstrel_courtship_poem_teach_4:minstrel_courtship_poem_teach_reject|Peuh ! Qu'est-ce que cette poésie burlesque ?
dlga_minstrel_courtship_poem_teach_reject:minstrel_pretalk|Si le poème n'est pas à votre goût, alors gardez votre argent. Mais souvenez-vous qu'avec les poètes et les amoureux, l'important n'est pas ce qui vous plaît. L'important est ce qui plaît à qui vous écoute. Si vous voulez apprendre le poème, je suis toujours disposé à m'en charger.
dlga_minstrel_learn_poem_continue:close_window|Très bien... Mais il y a de nombreuses strophes à suivre. Bon, écoutez bien...
dlga_minstrel_1:minstrel_gossip|Pouvez-vous me parler des bons partis de ce royaume ?
dlga_minstrel_gossip:minstrel_gossip_select À propos de qui désirez-vous savoir?
dlga_minstrel_gossip_select:minstrel_gossip_maiden_selected_2|Parlez-moi juste des derniers commérages.
dlga_minstrel_gossip_select:minstrel_gossip_maiden_selected|{s10}
dlga_minstrel_gossip_select:minstrel_pretalk|Peu importe.
dlga_minstrel_gossip_maiden_selected:minstrel_gossip_maiden_selected_2|{s16}
dlga_minstrel_gossip_maiden_selected_2:minstrel_postgossip|Elle est votre épouse, bien-sûr ! Clairement, nul ne songe qu'elle pourrait faire quoi que ce soit pour générer des commérages.
dlga_minstrel_gossip_maiden_selected_2:minstrel_postgossip.1|{s12}.
dlga_minstrel_gossip_maiden_selected_2:minstrel_postgossip.2|{s12}
dlga_minstrel_postgossip:minstrel_pretalk|Très intéressant... Mais parlons d'autre chose.
dlga_minstrel_postgossip:minstrel_gossip|Très intéressant… Y a-t-il d'autres nouvelles ?
dlga_minstrel_postgossip:minstrel_duel_confirm|Quoi ? Ce minable va devoir affronter mon épée.
dlga_minstrel_duel_confirm:minstrel_duel_confirm_2|Vous le pensez ? Cela sera un honneur pour le {s11} de vous combattre, mais défier un seigneur en duel pour une femme est un peu impétueux, même en ces temps guerriers.
dlga_minstrel_duel_confirm_2:minstrel_duel_issued|Oui. J'envisage de forcer le {s11} à renoncer à courtiser {s12}
dlga_minstrel_duel_confirm_2:minstrel_pretalk|Non, je me laisse aller à mes passions, là.
dlga_minstrel_duel_issued:minstrel_pretalk|Comme vous voudrez. Je vais faire connaître vos intentions de manière à ce que le {s13} n'essaie pas de se défiler...
dlga_minstrel_1:minstrel_courtship_locations|Savez-vous s'il y a des banquets d'organisés en ce moment ?
dlga_minstrel_courtship_locations:minstrel_pretalk|{s12}
dlga_minstrel_1:close_window|Au revoir.
dlga_minstrel_courtship_questions:minstrel_courtship_questions_2|Que voulez-vous savoir ?
dlga_minstrel_courtship_prequestions:minstrel_courtship_questions_2|Puis-je répondre à d'autres questions?
dlga_minstrel_courtship_questions_2:minstrel_player_role|Y a-t-il une place pour moi au jeu de l'amour ?
dlga_minstrel_courtship_questions_2:minstrel_player_advice_meet|Comment un soupirant peut-il rencontrer une dame ?
dlga_minstrel_courtship_questions_2:minstrel_player_advice_woo|Après avoir rencontré une dame, comment un aspirant la courtise-t-il ?
dlga_minstrel_courtship_questions_2:minstrel_nobles|Parlez-moi du mariage et de l'amour parmi la noblesse de Westeros et Essos.
dlga_minstrel_nobles:minstrel_nobles_2|Les nobles sont étranges. À Calradia, une jeune fille est un atout politique que l'on offre à un seigneur avec lequel le père de cette jeune fille souhaite sceller une alliance. Cela étant, les grandes familles de ce pays idéalisent l'amour entre un homme et une femme et j'ai vu bien des guerriers redoutables pleurer à chaudes larmes en écoutant l'histoire de Sahira et Janun... Même s'ils envisageaient de briser le coeur de leur fille.
dlga_minstrel_nobles_2:minstrel_nobles_3|Tous les pères ne sont pas pareils, évidemment. Certains nobles de Calradia permettent à leurs filles de choisir elles-mêmes leur mari. D'autres, en revanche, pensent qu'en agissant ainsi leur autorité s'en trouverait ébranlée, et insistent donc pour leur imposer un époux bon gré mal gré.
dlga_minstrel_nobles_3:minstrel_prequestions|Mais la majorité des nobles se situent au milieu de tout cela, ils prennent la décision finale concernant l'époux, mais tiennent compte des préférences de leurs filles. Entre autres facteurs, un mariage heureux a plus de chance de donner naissance à des héritiers. Aussi, la cour est-elle à l'honneur pour gagner le coeur d'une dame.
dlga_minstrel_courtship_questions_2:minstrel_daughter_father|Et que se passe-t-il si une dame et son père ne sont pas d'accord sur un prétendant ?
dlga_minstrel_daughter_father:minstrel_daughter_father_2|Il arrive parfois qu'une jeune fille s'enfuie pour se marier. Le prestige du père en prend alors un sérieux coup, et il peut en résulter une haine durable envers l'époux. En effet, les femmes peuvent être à l'origine de guerres. Ceci étant, c'est un très beau sujet pour une chanson.
dlga_minstrel_daughter_father_2:minstrel_prequestions|En fin de compte, cependant, la plupart des jeunes filles se conforment au choix de leurs parents. Pour elles, la famille est tout, et rares sont celles qui ont le courage de s'y opposer pour un être qu'elles connaissent à peine. Elles peuvent se languir d'un homme, mais accepter d'en épouser un autre... Et sans amour tragique, que chanterions-nous ?
dlga_minstrel_player_role:minstrel_player_role_2|Bien sûr ! Les seigneurs de Calradia accordent une grande importance à la lignée, mais au bout du compte, les terres et l'argent pèsent davantage que les ancêtres. Même un étranger, pourvu qu'il se montre à la hauteur, peut être considéré par bon nombre de parents comme un bon parti.
dlga_minstrel_player_role_2:minstrel_player_role_3|Vous devrez concourir avec de nombreux autres seigneurs de votre royaume, mais ceux-ci ont un avantage : ils connaissent ces jeunes filles depuis l'enfance, et auront été choisis de longue date par des mères et des tantes pleines de discernement. Certaines jeunes filles sont fascinées par les étrangers, mais opteront finalement pour ceux qui leur sont familiers.
dlga_minstrel_player_role_3:minstrel_prequestions|Alors sachez ceci : vous pourriez en avoir le cœur brisé. Mais entrer dans l'arène de l'amour en ayant peur d'avoir le cœur brisé revient à entrer sur le champ de bataille en ayant peur des flèches ennemies. Faites preuve de courage, méprisez la rebuffade, et vous pourriez l'emporter.
dlga_minstrel_player_role:minstrel_female_player_3|Madame, je vais vous parler franchement. La plupart des seigneurs de ce pays cherchent une épouse à la peau aussi blanche que de la neige... et votre peau est brûlée par le soleil. Ils veulent une épouse dont la voix est douce comme des clochettes... et votre voix est roque à force de commander les hommes au combat. Qui plus est, bien que les seigneurs de Calradia apprécient les poèmes sur l'amour, la plupart veulent des héritiers, et peu de femmes peuvent monter à cheval et se battre tout en s'occupant de leus enfants.
dlga_minstrel_female_player_3:minstrel_prequestions|Mais tous les seigneurs ne sont pas aussi conventionnels. Nous, les poètes, nous parlons de guerrières et de chasseuses, de femmes qui ont suivi leur voie sans sacrifier leur chance de tomber amoureuses. Je ne vais pas vous dire qu'il vous sera facile de trouver un mari qui acceptera votre vie, mais sachez que ce n'est pas impossible.
dlga_minstrel_courtship_questions_2:minstrel_spouse_benefits|Quel avantage le fait de chercher {une épouse/un mari} présente-t-il ?
dlga_minstrel_spouse_benefits:minstrel_wife_benefits_2|Ah ! Je vois que vous êtes romantique ! Et bien, hormis les avantages évidents de l'amour, la vie à deux et autres... hum, activités, se marier dans la noblesse présente d'importants atouts. Vous pouvez sceller une solide alliance avec la famille de la mariée et une épouse peut, en outre, vous aider à manipuler la politique du royaume pour en tirer bénéfice.
dlga_minstrel_wife_benefits_2:minstrel_prequestions|Qui plus est, la plupart des grandes familles de Calradia se sont, à un moment ou à un autre, mariées avec des membres de la royauté, ce qui permet, en quelque sorte, de pouvoir revendiquer le trône...
dlga_minstrel_spouse_benefits:minstrel_wife_benefits_2.1|Ah ! Je vois que vous êtes romantique ! Et bien, hormis les avantages évidents de l'amour, la vie à deux et autres... hum, activités, se marier dans la noblesse présente d'importants atouts. Vous pouvez notamment disposer des châteaux et propriétés de votre époux et œuvrer avec lui pour asseoir votre position dans le royaume.
dlga_minstrel_player_advice_meet:minstrel_player_advice_meet_2|De temps à autre, un roi ou un grand seigneur de Calradia organise un banquet. Dans les villes, ils s'accompagnent souvent de tournois et dans les châteaux, de chasses. Les banquets permettent aux seigneurs de mettre fin à certaines rivalités susceptibles de nuire à la puissance du royaume. Ils permettent également aux familles de présenter leurs filles à marier, et les dames sont souvent autorisées à se mêler, sans surveillance, aux invités.
dlga_minstrel_player_advice_meet_2:minstrel_prequestions|Si vous en avez la possibilité, vous pouvez essayer de complimenter la dame pour lui indiquer que vous êtes un soupirant éventuel. Elle sait généralement si elle souhaite ou non se laisser courtiser. Soit dit en passant, si vous venez vers elle après vous être distingué lors du tournoi ou de la chasse, vous pouvez tout à fait lui faire une plus grande impression encore.
dlga_minstrel_player_advice_woo:minstrel_player_advice_woo_2|Courtiser une dame nécessite du temps, de la patience, ainsi que plusieurs rendez-vous espacés sur quelques mois. Une dame qui s'intéresse à vous ne manquera pas de vous faire savoir qu'elle désire que vous lui rendiez visite. De même, vous pouvez également aller voir son père ou son frère pour lui en demander l'autorisation. S'il vous la refuse, il peut être possible d'organiser une rencontre par d'autres moyens.
dlga_minstrel_player_advice_woo_2:minstrel_player_advice_woo_3|Après avoir organisé une rencontre, vous pouvez essayer de la charmer et de gagner sa faveur. Le plus difficile, dans tout cela, est peut-être de trouver un sujet de conversation. La plupart des jeunes filles de la noblesse de Calradia vivent cloîtrées, du moins avant de se marier, et n'ont pas grand-chose à dire susceptible de vous intéresser. D'un autre côté, elles se lassent rapidement d'entendre le récit de vos exploits dans le monde extérieur.
dlga_minstrel_player_advice_woo_3:minstrel_player_advice_woo_4|Pour courtiser une dame, vous pouvez simplement lui réciter un poème connu et en discuter. Ainsi, vous êtes tous les deux sur un même pied d'égalité et aucun ne prend le pas en termes d'avantage ou d'expérience. Bien sûr, en matière de poésie, les dames affichent des goûts différents.
dlga_minstrel_player_advice_woo_4:minstrel_player_advice_woo_5|Au bout d'un moment, il vous faudra aborder franchement la question du mariage. Elle vous fera alors savoir si vous répondez à ce qu'elle attend d'un époux. Certaines dames n'hésiteront pas à opter pour le plus prestigieux de leurs aspirants, d'autres écouteront leur cœur. Certaines encore observeront vos compagnons pour savoir si vous êtes le genre d'homme qui la traiterez en égale, d'autres suivront les conseils de leur père.
dlga_minstrel_player_advice_woo_5:minstrel_prequestions|Quoi qu'il en soit, ce n'est jamais chose aisée. Et n'oubliez pas que votre cour auprès d'une jeune fille peut porter ses fruits, mais ne pas satisfaire les ambitions politique de son père. Et vous devrez alors vous demander si vous êtes prêt à prendre le risque d'être déçu ou d'avoir le cœur brisé. De même, êtes-vous prêt à renoncer à votre position dans la société, et à faire de vos alliés des ennemis, pour vivre un amour interdit ? Car si tel est le cas, il est possible qu'un jour, nous écrivions des poèmes parlant de vous.
dlga_minstrel_courtship_questions_2:minstrel_job_description|Pouvez-vous me rappeler ce que vous faites, vous les poètes et les musiciens ?
dlga_minstrel_job_description:minstrel_courtship_prequestions|Je compose et j'écris des chansons pour les seigneurs du pays et leurs dames. Parfois, je chante sur la guerre, sur les vertus des rois et, parfois, pour les publics les plus sophistiqués, sur les vertus du vin. Mais la plupart du temps, je chante sur l'amour.
dlga_minstrel_courtship_questions_2:minstrel_pretalk|Non, c'est tout.
dlga_minstrel_prequestions:minstrel_courtship_questions_2|Vous avez d'autres questions ?
dlga_minstrel_pretalk:minstrel_1|Y a-t-il autre chose?
dlga_start:farmer_from_bandit_village_1|{Messire/Madame}, vous semblez savoir manier l'épée et être quelqu'un qui pourrait nous aider. Écouterez-vous mon humble requête ?
dlga_farmer_from_bandit_village_1:farmer_from_bandit_village_2|Que se passe-t-il, mon brave ?
dlga_farmer_from_bandit_village_1:farmer_from_bandit_village_2.1|Qu'est-ce que vous attendez, paysan ? Parlez !
dlga_farmer_from_bandit_village_2:farmer_from_bandit_village_3|Une bande de brigands a pris d'assaut notre village. Ils prennent tout ce que nous avons, nous forcent à travailler pour eux et nous font beaucoup de mal. Si l'un d'entre nous laisse échapper un mot de protestation, ils le tuent sur place. Notre vie est insupportable. Nos vies sont devenues insupportables. J'ai risqué ma peau et je me suis enfui pour trouver quelqu'un qui pourrait nous aider.
dlga_farmer_from_bandit_village_3:farmer_from_bandit_village_4|Pourquoi n'allez vous pas voir le seigneur de votre village ? Il devrait s'occuper de cette vermine.
dlga_farmer_from_bandit_village_4:farmer_from_bandit_village_5|Je l'ai fait {messire/madame}, mais les hommes de notre seigneur ne m'ont pas laissé le voir et m'ont dit qu'il avait plus important à faire et que nous devrions gérer notre problème nous-mêmes. Je vous en prie {messire/madame}, vous semblez être {un homme courageux et un guerrier/une femme courageuse et une guerrière} inspirant la crainte, et de nombreux amis et soldats sont sans aucun doute à votre service. Si quelqu'un peut nous aider, c'est vous.
dlga_farmer_from_bandit_village_5:farmer_from_bandit_village_accepted|Très bien, je vais vous aider. Où se trouve ce village ?
dlga_farmer_from_bandit_village_5:farmer_from_bandit_village_denied|Je ne peux pas m'occuper de cela pour l'instant.
dlga_farmer_from_bandit_village_5:farmer_from_bandit_village_barter|Pourquoi combattrais-je ces bandits ? Quel intérêt aurais-je à le faire ?
dlga_farmer_from_bandit_village_accepted:close_window|Dieu vous bénisse {messire/madame}. Notre village est {s7}, ce n'est pas très loin d'ici.
dlga_farmer_from_bandit_village_denied:close_window|Comme il vous plaira {messire/madame}, pardonnez-moi de vous avoir dérangé.
dlga_farmer_from_bandit_village_barter:farmer_from_bandit_village_5|Nous ne sommes que de pauvres fermiers, {messire/madame}, et les bandits nous ont déjà pris presque tout ce que nous avions en ce monde. Mais nous serons heureux de partager avec vous le peu qu'il nous reste. Et nous vous serons éternellement reconnaissants si vous nous aidez.
dlga_start:close_window.80|Merci de nous aider {ser / madam}. Éclatez ces bandits!
dlga_start:violet_talk1|Bonjour. En quoi puis-je vous aider?
dlga_start:violet_talk3|Hey, {playername}. Comment puis-je t'aider?
dlga_violet_pretalk:violet_talk3|(Aelfwyn regarde autour pour voir si d'autres clients en ont besoin.)
dlga_violet_pretalk:violet_talk3.1|(Aelfwyn regarde les autres clients, mais elle semble sourire quand vous regardez dans sa direction.)
dlga_violet_talk1:violet_talk2.1|Mon nom est {playername}. Quel est ton nom?
dlga_violet_talk1:violet_talk2.2|Comment s'appelle-t-il, beau? Je suis {playername}.
dlga_violet_talk1:violet_talk2.3|Je viens de passer. Que recommandez-vous?
dlga_violet_talk1:close_window|Nothing. Désolé de vous déranger.
dlga_violet_talk2.1:violet_talk3|(avec un sourire amical, dit-elle) ^ Je suis Aelfwyn. Si vous voulez quelque chose à manger ou à boire, demandez et je l'obtiendrais pour vous. Si vous cherchez un endroit pour rester la nuit, vous pouvez parler au taverner.
dlga_violet_talk2.2:violet_talk3|(Elle baissa les yeux et donne un soupir agacé) ^ Je suis Aelfwyn. Si vous voulez quelque chose à manger ou à boire, demandez et je l'obtiendrais pour vous. Si vous cherchez un endroit pour passer la nuit, vous devrez parler au taverner.
dlga_violet_talk2.3:violet_talk3|Eh bien, je peux vous demander de manger ou de boire si vous le souhaitez, mais si vous cherchez un endroit où passer la nuit, vous devrez parler au taverner.
dlga_violet_talk3:violet_talk4|Commandez un verre.
dlga_violet_talk3:violet_talk5|Commandez de la nourriture.
dlga_violet_talk3:violet_talk6|Flirt avec elle.
dlga_violet_talk3:close_window|Merci. C'est tout ce dont j'ai besoin pour l'instant.
dlga_violet_talk4:violet_talk4.1|Que souhaiteriez-vous?
dlga_violet_talk4.1:violet_talk_grog|L'eau (1 cerf d'argent)
dlga_violet_talk4.1:violet_talk_beer|Bad Wine (bière) (8 cerfs d'argent)
dlga_violet_talk4.1:violet_talk_ale|Ale (bière) (10 cerfs d'argent)
dlga_violet_talk4.1:violet_talk_mead|Medu (Mead) (12 cerfs d'argent)
dlga_violet_talk4.1:violet_talk_wine|Vin (20 cerfs d'argent)
dlga_violet_talk4.1:violet_pretalk|J'ai changé d'avis.
dlga_violet_talk5:violet_talk5.1|Que souhaiteriez-vous?
dlga_violet_talk5.1:violet_talk_cabbage|Poulet (1 cerf argenté)
dlga_violet_talk5.1:violet_talk_bread|Pain à l'ail (2 cerfs d'argent)
dlga_violet_talk5.1:violet_talk_fish|Poisson fumé (4 cerfs d'argent)
dlga_violet_talk5.1:violet_talk_sausage|Mearhaeccel (saucisse de cheval) (6 cerfs d'argent)
dlga_violet_talk5.1:violet_talk_chicken|Tige de sanglier (8 cerfs d'argent)
dlga_violet_talk5.1:violet_talk_ham|Jambon rôti (10 cerfs d'argent)
dlga_violet_talk5.1:violet_talk_beef|Rôti de boeuf (12 cerfs d'argent)
dlga_violet_talk5.1:violet_talk_steak|Steak (15 cerfs d'argent)
dlga_violet_talk5.1:violet_pretalk|J'ai changé d'avis.
dlga_violet_talk_grog:violet_pretalk|(Bien qu'un peu gâché, l'eau est encore assez savoureuse pour être agréable.)
dlga_violet_talk_beer:violet_pretalk|(C'est un brew plutôt ordinaire. La jeune fille vous écoute et vos histoires pendant que vous buvez, jusqu'à ce qu'elle soit appelée dans une autre table.)
dlga_violet_talk_ale:violet_pretalk|(Le Mealttealoth est fort et délicieux. La jeune fille écoute vos compliments pendant que vous buvez. Elle oublie un moment qu'elle est au travail.)
dlga_violet_talk_mead:violet_pretalk|(Cette médaille est si savoureuse que vous pouvez à peine déguster l'alcool. Vous et Aelfwyn ont passé un bon moment ensemble, jusqu'à ce qu'elle soit convoquée par le taverner pour servir d'autres clients.)
dlga_violet_talk_wine:violet_pretalk|(Le vin est excellent et vous en profitez pour goûter à la jeune fille. Elle est éblouie avec vous)
dlga_violet_talk_cabbage:violet_pretalk|(Le poulet n'est pas mauvais.)
dlga_violet_talk_bread:violet_pretalk|(Le pain à l'ail est léger et floconneux).
dlga_violet_talk_fish:violet_pretalk|(Le poisson est ferme mais floconneux. La jeune fille vous écoute et vos histoires pendant que vous buvez, jusqu'à ce qu'elle soit appelée dans une autre table.)
dlga_violet_talk_sausage:violet_pretalk|(Une saucisse épicée et fortement fumée à base de viande de cheval. Il est incroyable.)
dlga_violet_talk_chicken:violet_pretalk|(Le sanglier est tendre et juteux.  La jeune fille écoute votre bulle de guerre et d'or pendant que vous mangez. Ravie, elle oublie un instant qu'elle est au travail.)
dlga_violet_talk_ham:violet_pretalk|(Le jambon est doux et humide. C'est délicieux.)
dlga_violet_talk_beef:violet_pretalk|(Le bœuf est tendre et juteux. Vous et Aelfwyn passent un bon moment amusant ensemble, jusqu'à ce qu'un autre client stupide l'appelle loin de vous.)
dlga_violet_talk_steak:violet_pretalk|(Le steak est tendre et juteux et vous en donnez un gros morceau à la fille. Elle est éblouie avec vous.)
dlga_violet_talk6:violet_talk6.1|(Après avoir attiré l'attention, Aelfwyn arrive et vous regarde patiemment.)
dlga_violet_talk6.1:violet_talk_flirt|Clignez sur elle.
dlga_violet_talk6.1:violet_talk_flirt.1|Dites-lui une blague.
dlga_violet_talk6.1:violet_talk_flirt.2|Complétez-la.
dlga_violet_talk6.1:violet_talk_flirt.3|Baiser sa main.
dlga_violet_talk6.1:violet_talk_flirt.4|Baiser sa joue.
dlga_violet_talk6.1:violet_talk_flirt.5|L'embrasse sur les lèvres.
dlga_violet_talk6.1:violet_talk_flirt.6|Prenez-la derrière.
dlga_violet_talk6.1:violet_talk_flirt.7|Prenez-la dans votre chambre.
dlga_violet_talk6.1:violet_pretalk|Ne vous contentez pas.
dlga_violet_talk_flirt:violet_pretalk|{s20}.
dlga_start:violet2_talk1|Bonjour. En quoi puis-je vous aider?
dlga_start:violet2_talk3|Hey, {playername}. Comment puis-je t'aider?
dlga_violet2_pretalk:violet2_talk3|(Lunete regarde autour pour voir si d'autres clients en ont besoin.)
dlga_violet2_pretalk:violet2_talk3.1|(Lunete regarde les autres clients, mais elle semble sourire quand vous regardez dans sa direction.)
dlga_violet2_talk1:violet2_talk2.1|Mon nom est {playername}. Quel est ton nom?
dlga_violet2_talk1:violet2_talk2.2|Comment s'appelle-t-il, beau? Je suis {playername}.
dlga_violet2_talk1:violet2_talk2.3|Je viens de passer. Que recommandez-vous?
dlga_violet2_talk1:close_window|Nothing. Désolé de vous déranger.
dlga_violet2_talk2.1:violet2_talk3|((Avec un sourire amical, elle dit) ^ I'm Lunete. Si vous voulez quelque chose à manger ou à boire, demandez et je l'obtiendrais pour vous. Si vous cherchez un endroit pour rester la nuit, vous pouvez parler au tavernkeeper.
dlga_violet2_talk2.2:violet2_talk3|(Elle baissa les yeux et donne un soupir agacé) ^ Je suis Lunete. Si vous voulez quelque chose à manger ou à boire, demandez et je l'obtiendrais pour vous. Si vous cherchez un endroit pour rester la nuit, vous devrez parler au tavernkeeper.
dlga_violet2_talk2.3:violet2_talk3|Eh bien, je peux vous demander de manger ou de boire si vous le souhaitez, mais si vous cherchez un endroit pour rester la nuit, vous devrez parler au tavernkeeper.
dlga_violet2_talk3:violet2_talk4|Commandez un verre.
dlga_violet2_talk3:violet2_talk5|Commandez de la nourriture.
dlga_violet2_talk3:violet2_talk6|Flirt avec elle.
dlga_violet2_talk3:close_window|Merci. C'est tout ce dont j'ai besoin pour l'instant.
dlga_violet2_talk4:violet2_talk4.1|Que souhaiteriez-vous?
dlga_violet2_talk4.1:violet2_talk_grog|Eau (1 cerf d'argent)
dlga_violet2_talk4.1:violet2_talk_beer|Bad Wine (bière) (8 cerfs d'argent)
dlga_violet2_talk4.1:violet2_talk_ale|Mealttealoth (bière) (10 cerfs d'argent)
dlga_violet2_talk4.1:violet2_talk_mead|Medu (Mead) (12 cerfs d'argent)
dlga_violet2_talk4.1:violet2_talk_wine|Vin (20 cerfs d'argent)
dlga_violet2_talk4.1:violet2_pretalk|J'ai changé d'avis.
dlga_violet2_talk5:violet2_talk5.1|Que souhaiteriez-vous?
dlga_violet2_talk5.1:violet2_talk_cabbage|Poulet (1 cerf d'argent)
dlga_violet2_talk5.1:violet2_talk_bread|Pain à l'ail (2 cerfs d'argent)
dlga_violet2_talk5.1:violet2_talk_fish|Poisson fumé (4 cerfs d'argent)
